{
  "$schema": "https://json-schema.org/draft/2020-12/schema",
  "$id": "https://example.local/schemas/lanes.schema.json",
  "title": "Lane registry",
  "type": "array",
  "items": {
    "type": "object",
    "additionalProperties": false,
    "required": ["id", "title", "repoPath", "sessionName"],
    "properties": {
      "id": {"type": "string", "pattern": "^[a-z0-9][a-z0-9-]*$"},
      "title": {"type": "string", "minLength": 1},
      "repoPath": {"type": "string", "minLength": 1},
      "jjBookmark": {"type": "string", "minLength": 1},
      "sessionName": {"type": "string", "minLength": 1},
      "serverCommand": {"type": "string", "minLength": 1},
      "priority": {"type": "string", "enum": ["main", "side", "parked"]},
      "status": {"type": "string", "enum": ["active", "paused", "archived"]},
      "notes": {"type": "string"},
      "tags": {
        "type": "array",
        "items": {"type": "string", "minLength": 1},
        "uniqueItems": true
      }
    }
  }
}
