[
  {
    "id": "mt-core",
    "title": "Multithreading large subsystem",
    "repoPath": "/Users/pat/Work/project",
    "jjBookmark": "pat/mt-core",
    "sessionName": "mt-core",
    "serverCommand": "./scripts/start-dev ce",
    "priority": "main",
    "status": "active",
    "tags": ["rendering", "performance"]
  },
  {
    "id": "pdfua-paragraphs",
    "title": "PDF/UA paragraph detection",
    "repoPath": "/Users/pat/Work/project",
    "jjBookmark": "pat/pdfua-paragraphs",
    "sessionName": "pdfua-paragraphs",
    "serverCommand": "./scripts/start-dev pdfua",
    "priority": "main",
    "status": "active",
    "tags": ["pdfua", "heuristics"]
  }
]
